{
  "id": "fp2-202505-jafp-q04",
  "qualificationId": "fp2",
  "examPartId": "jafp-practical",
  "topicId": "financial-assets",
  "version": 2,
  "status": "draft",
  "title": "2025年5月公表 2級実技・問4",
  "source": "日本FP協会2025年5月公表・2級FP技能検定実技（資産設計提案業務）。原本の文字起こし・回答欄構成・独自解説を追加。",
  "body": "下記＜資料＞の外貨定期預金について、満期時の外貨ベースの元利合計額を円転した金額を計算しな\nさい。なお、計算結果（円転した金額）について円未満の端数が生じる場合は切り捨てること。また、\n解答に当たっては、解答欄に記載されている単位に従うこと。\n\n\n＜資料＞\n\n 預入額：１０,０００豪ドル\n 預入期間：１２ヵ月\n 預金金利：２.５％（年率）\n 為替レート（１豪ドル）\n           ：\n            ＴＴＳ     ＴＴＭ（仲値）     ＴＴＢ\n     満期時   ９１.２０円   ８８.７０円     ８６.２０円\n\n\n 注１：利息の計算に際しては、預入期間は日割りではなく月単位で計算すること。\n 注２：利息に対しては、豪ドル建ての利息額の２０％相当額が所得税・住民税として源泉徴収され\n      るものとし、為替差益・為替差損に対する税金については考慮しないものとする。",
  "sourceImages": [],
  "bodyFigures": [],
  "items": [
    {
      "id": "item1",
      "label": "問4",
      "prompt": "原本にある指定単位・端数処理・数値表を参照して計算する。",
      "fields": [
        {
          "id": "amount",
          "label": "金額",
          "type": "numeric",
          "maxLength": 100,
          "grading": {
            "method": "exactDecimal"
          },
          "numeric": {
            "unit": "円",
            "decimalPlaces": 0,
            "rounding": "floor"
          },
          "referenceAnswers": [
            "879240"
          ],
          "explanation": "豪ドル元本10,000に年利2.5%・1年間の利息250豪ドルを付け、利息の税20%を差し引いた純利息200豪ドルを加算。**10,200豪ドル×TTB86.20円＝879,240円**。",
          "rubric": [
            "問題文の指示と指定単位「円」を確認し、879240円となる計算過程を照合する。"
          ]
        }
      ]
    }
  ],
  "sourceRecord": {
    "publisher": "日本FP協会",
    "publishedAt": null,
    "legalAsOf": null,
    "questionUrl": "https://www.jafp.or.jp/exam/mohan/files/j2_202505_q.pdf",
    "questionSha256": "df7d6d243787defb7f32c4f4d4da8c20f7819717fabeb3e62098e3b6d5d367bb",
    "answerUrl": "https://www.jafp.or.jp/exam/mohan/files/j2_202505_a.pdf",
    "answerSha256": "51dce471c7cccb55d6470b8599b79517c1fc31b17b56da6b3edcd9944289d4f8",
    "modifiedFromOriginal": true,
    "modificationNote": "原本の1問をcaseに分割し、公式正答に対応する各回答欄と解説、図表・資料画像を追加。独立レビュー未実施。"
  },
  "legalReview": {
    "status": "unverified",
    "checkedAt": null,
    "sourceRefs": [],
    "note": "原本の実技法令基準日は未確認。現行制度の適合は未確認。"
  }
}
