{
  "id": "fp2-202505-jafp-q03",
  "qualificationId": "fp2",
  "examPartId": "jafp-practical",
  "topicId": "financial-assets",
  "version": 2,
  "status": "draft",
  "title": "2025年5月公表 2級実技・問3",
  "source": "日本FP協会2025年5月公表・2級FP技能検定実技（資産設計提案業務）。原本の文字起こし・回答欄構成・独自解説を追加。",
  "body": "長谷川さんは、保有しているＲＭ投資信託（追加型国内公募株式投資信託）の収益分配金を当年中に\n受け取った。ＲＭ投資信託の運用状況が下記＜資料＞のとおりである場合、収益分配後の個別元本とし\nて、正しいものはどれか。\n\n\n＜資料＞\n\n［長谷川さんが保有するＲＭ投資信託の収益分配金受取時の状況］\n 収益分配前の個別元本：１０,８００円\n 収益分配前の基準価額：１１,４００円\n 収益分配金：１,０００円\n 収益分配後の基準価額：１０,４００円",
  "sourceImages": [],
  "bodyFigures": [],
  "items": [
    {
      "id": "item1",
      "label": "問3",
      "prompt": "原本から4択の正答番号を1つ選択する。",
      "fields": [
        {
          "id": "answer",
          "label": "問3の正答番号",
          "type": "singleChoice",
          "grading": {
            "method": "exactText"
          },
          "referenceAnswers": [
            "3"
          ],
          "choices": [
            {
              "id": "option-1",
              "label": "1",
              "text": "９,８００円"
            },
            {
              "id": "option-2",
              "label": "2",
              "text": "１０,２００円"
            },
            {
              "id": "option-3",
              "label": "3",
              "text": "１０,４００円"
            },
            {
              "id": "option-4",
              "label": "4",
              "text": "１０,８００円"
            }
          ],
          "explanation": "分配前個別元本10,800円に対し分配後基準価額10,400円なので、**元本払戻金（特別分配金）400円**を控除した個別元本は10,400円。",
          "rubric": [
            "公式問題の4選択肢を比較し、指定された「最も適切／不適切」の1つを選ぶ。"
          ]
        }
      ]
    }
  ],
  "sourceRecord": {
    "publisher": "日本FP協会",
    "publishedAt": null,
    "legalAsOf": null,
    "questionUrl": "https://www.jafp.or.jp/exam/mohan/files/j2_202505_q.pdf",
    "questionSha256": "df7d6d243787defb7f32c4f4d4da8c20f7819717fabeb3e62098e3b6d5d367bb",
    "answerUrl": "https://www.jafp.or.jp/exam/mohan/files/j2_202505_a.pdf",
    "answerSha256": "51dce471c7cccb55d6470b8599b79517c1fc31b17b56da6b3edcd9944289d4f8",
    "modifiedFromOriginal": true,
    "modificationNote": "原本の1問をcaseに分割し、公式正答に対応する各回答欄と解説、図表・資料画像を追加。独立レビュー未実施。"
  },
  "legalReview": {
    "status": "unverified",
    "checkedAt": null,
    "sourceRefs": [],
    "note": "原本の実技法令基準日は未確認。現行制度の適合は未確認。"
  }
}
